{
  "$schema": "../../schema/skill.schema.json",
  "id": "acrobatics",
  "name": "Acrobacia",
  "abilityId": "destreza",
  "exampleUses": "Manter-se em pé em uma situação complicada ou realizar uma acrobacia.",
  "source": {
    "book": "Livro do Jogador 2024",
    "language": "pt-BR",
    "chapter": 1,
    "chapterTitle": "Jogando o Jogo",
    "pdfPath": "doc/livro-jogador.pdf",
    "pdfPages": [
      14,
      369
    ]
  },
  "actionIds": [
    "hide",
    "escape-grapple"
  ]
}
