{
  "$schema": "../../schema/skill.schema.json",
  "id": "deception",
  "name": "Enganação",
  "abilityId": "carisma",
  "exampleUses": "Contar uma mentira convincente ou usar um disfarce de forma convincente.",
  "source": {
    "book": "Livro do Jogador 2024",
    "language": "pt-BR",
    "chapter": 1,
    "chapterTitle": "Jogando o Jogo",
    "pdfPath": "doc/livro-jogador.pdf",
    "pdfPages": [
      14,
      370
    ]
  },
  "actionIds": [
    "influence"
  ],
  "influenceUse": "Enganar um monstro que entende você"
}
