{
  "$schema": "../../schema/skill.schema.json",
  "id": "intimidation",
  "name": "Intimidação",
  "abilityId": "carisma",
  "exampleUses": "Atemorizar ou ameaçar alguém para que faça o que você quer.",
  "source": {
    "book": "Livro do Jogador 2024",
    "language": "pt-BR",
    "chapter": 1,
    "chapterTitle": "Jogando o Jogo",
    "pdfPath": "doc/livro-jogador.pdf",
    "pdfPages": [
      14,
      370
    ]
  },
  "actionIds": [
    "influence"
  ],
  "influenceUse": "Intimidar um monstro"
}
