{
  "$schema": "../../schema/skill.schema.json",
  "id": "insight",
  "name": "Intuição",
  "abilityId": "sabedoria",
  "exampleUses": "Perceber o humor e as intenções de uma pessoa.",
  "source": {
    "book": "Livro do Jogador 2024",
    "language": "pt-BR",
    "chapter": 1,
    "chapterTitle": "Jogando o Jogo",
    "pdfPath": "doc/livro-jogador.pdf",
    "pdfPages": [
      14,
      373
    ]
  },
  "actionIds": [
    "search"
  ],
  "searchUse": "Estado mental de uma criatura"
}
